id,title,status,programs,evidence,summary,implication
C1,Structured intermediates improve small-model reliability,Confirmed,structured_execution_and_compilers;reliability_and_safety,qwen_structural_latent_compiler_expansion;qwen35_4b_foofah_selective_program_fallback;qwen35_4b_operator_inventory_search_pilot,"Executable, typed, latent, or otherwise structured intermediates repeatedly create checkable surfaces that direct final-answer prompting lacks.",Future direct-answer tasks should include a structured-output or executable-evidence baseline before making broad claims.
C2,Candidate coverage does not imply deployable accuracy,Confirmed,evidence_conditioned_selection;reliability_and_safety,qwen35_4b_retrieval_adapt_verify_scale;qwen35_4b_foofah_selective_program_fallback;qwen35_4b_independent_retrieval_consensus,Candidate pools can contain hidden-correct answers while visible evidence still selects or commits incorrectly.,"Candidate-pool work should report oracle coverage, deployable selection, false-pass rate, precision, recall, and abstention separately."
C3,Plain prompt memory is not enough,Negative,algorithmic_memory_and_retrieval;operator_and_skill_inventories,qwen_verified_skill_memory_rag;qwen35_4b_verified_algorithm_retrieval_adaptation,"Naive retrieved skill cards are a weak memory mechanism unless retrieval contributes candidates, tests, constraints, or verifier inputs.","Memory experiments should include random, mismatched, and constraint/test/candidate variants rather than only prompt-context variants."
C4,Active evidence must be coupled to downstream decisions,Promising,active_evidence_acquisition;process_control_and_tool_use;evidence_conditioned_selection,qwen_active_example_acquisition;qwen35_4b_active_counterexample_trace_selection;qwen35_4b_learned_active_trace_policy,"Actively selected examples and probes can help, but the acquisition objective must optimize the final selector, verifier, or controller decision.","Evidence-acquisition work should report downstream decision lift per evidence budget, not only probe informativeness."
C5,Adaptation must beat strong frozen alternatives,Open,posttraining_and_adaptation;process_control_and_tool_use,qwen35_4b_constrained_coverage_dpo;qwen35_4b_live_tool_dagger;qwen35_4b_oracle_process_grpo,"LoRA, DPO, distillation, GRPO, and DAgger are promising, but their value is unclear unless compared against frozen sampling, verification, retrieval, and tool-control alternatives.",Post-training runs should include frozen inference-time alternatives and explicit deployability boundaries.
C6,Controls are the difference between a result and a story,Confirmed,benchmark_generalization;interpretability_and_diagnostics;reliability_and_safety,factor_recombination_ladder;feature_factorized_rule_diversity;qwen_structural_compiler_attribution_ablation,"The strongest imported lessons come from experiments that separate mechanism from confounders through corrupted, shuffled, random, frozen, length-held-out, or family-held-out controls.",Future claims should name the mechanism-falsifying control before running expensive work.
C7,Reliability requires explicit hidden-label and artifact boundaries,Confirmed,reliability_and_safety;collective_experimentation_infrastructure,qwen35_4b_reliability_exec_opsd_audit;qwen35_4b_real_sample_verify_commit;.gitignore;scripts/validate_repository.py,The repository should preserve small reproducible artifacts while excluding trained adapters and labeling oracle-only evidence separately from deployable evidence.,"Reports and scaffolds must separate deployable evidence from hidden-oracle evaluation, and trained adapter directories must remain out of git."
C8,The repository itself is a research instrument,Confirmed,collective_experimentation_infrastructure,research_programs/registry.yaml;knowledge/program_scorecards.md;docs/quality_gates.md;.github/workflows/validate.yml,"Program charters, generated indexes, claim ledgers, scorecards, intake notes, templates, validation, and CI are part of the experiment system because they determine whether future work compounds.",New experiments should update program evidence and shared claims when they change what future work should believe.
C9,Native thinking's accuracy gain is coherent reasoning content at every budget (unused lever),Promising,test_time_reasoning_budget;process_control_and_tool_use,qwen35_4b_thinking_budget_scaling;qwen35_4b_thinking_budget_controller;qwen35_4b_thinking_separability_probe;qwen35_4b_thinking_content_vs_compute;qwen35_4b_overthinking_content_ladder;qwen_python_shaped_silent_executor,"Enabling Qwen3.5-4B's native thinking (disabled corpus-wide) raises deployable MBPP greedy pass@1 +15pp (0.76->0.91); greedy accuracy is non-monotonic (optimum ~1024, then decline), though sampled full-pass is roughly flat across budgets. A visible-test budget controller is an efficiency (not accuracy) win, bounded by C2 false-passes. NATURE OF THE GAIN (decomposed via filler/shuffle/foreign controls across budgets 512/1024/2048): the model USES thinking as CONTENT -- splicing a different task's thinking (foreign) collapses accuracy to ~3-4% because the model follows it to the wrong problem; pure forward compute (contentless '.' filler) ~= no_think at every budget; relevant-but-scrambled thinking (shuffle) ~= no_think; and coherent reasoning (real) is the ENTIRE gain (real-shuffle = +0.105/+0.108/+0.150 at 512/1024/2048 -- it GROWS with budget). So the thinking accuracy gain is coherent reasoning CONTENT at every budget, not compute, scaffold, or token-presence. The earlier 'mostly compute/scaffold, not reasoning' read was wrong -- it only appeared through a greedy-metric lens and a shuffle-protocol artifact in the scaling run (its '2048 shuffle~=real'). Separately, at the REPRESENTATIONAL level a linear probe on the answer-token activation finds correctness moderately decodable and thinking raises decodability, but shuffle>=real there (noisy, overlapping CIs) -- i.e. coherence improves ACCURACY without clearly improving internal correctness-decodability.","Re-baseline CoT-substitute results against a fair, budgeted native-thinking baseline. Native thinking's accuracy benefit is genuine reasoning content the model uses (credit it as such) -- but judge 'is it reasoning?' with content controls (filler + foreign), not a single greedy number, which misled here."
C10,The C2 selection wall is plumbing not capability: a thinking-verifier closes most of it,Promising,evidence_conditioned_selection;test_time_reasoning_budget,qwen35_4b_generator_verifier_gap;qwen35_4b_verifier_selector_showdown,"For a frozen Qwen3.5-4B on MBPP, intrinsic black-box self-verification (judge a candidate correct/incorrect from the A/B logit, no execution/hidden tests) is WEAK with no-think (balanced-acc 0.627, AUROC 0.773, heavy yes-bias: says 'correct' 0.91 vs base pass 0.771) but STRONG with thinking (balanced-acc 0.827, AUROC 0.926). The model's own thinking-verifier, zero-training and fully deployable (no execution), selects best-of-8 at 0.860, closing 75% of the pass@1(0.771)->oracle(0.890) gap (no-think closes only 24%); foreign-solution reject rate is 1.00. So the C2 coverage-vs-selection wall is a plumbing/evidence problem, not a verification-CAPABILITY limit -- the selection program has real headroom and the lever is thinking-augmented self-verification (cheaper/stronger than the trained selectors the corpus favored). This inverts C9: thinking helps VERIFICATION (+0.20 balanced-acc) at least as much as GENERATION -- its deepest value may be helping the model recognize correct answers, not just produce them. MATCHED-COST CAVEAT (selector showdown): when a cheap visible test exists, the thinking-verifier is Pareto-DOMINATED -- standalone 0.860 barely beats visible-only 0.850 at ~5x token cost, and combined the no-think verifier ties it (both 0.870). The deployable sweet spot is visible + FREE no-think verifier (0.870, closes 83% of the pass@1->oracle gap). So thinking-verification's expensive edge is real only in verifier-only settings (no cheap execution signal); the C2 wall is fixable, but with cheap plumbing (visible test + no-think verifier), not expensive thinking-verification.","The C2 selection wall is fixable with CHEAP plumbing: a visible/execution signal + a free no-think self-verifier. Reserve expensive thinking-verification for verifier-only settings. Evaluate native thinking as a verification lever, and always compare selector signals at matched token cost."
C11,Self-training on verified self-solutions banks capability; test-time execution feedback does not (contamination-free substrate),Promising,structured_execution_and_compilers;posttraining_and_adaptation,qwen35_4b_neurosymbolic_repl_substrate,"On a FRESH, procedurally-generated, CONTAMINATION-FREE program-synthesis substrate (random depth-D compositions of list primitives, graded by held-out execution; reference oracle solves 100%), built to test elicitation of the FIXED Qwen3.5-4B (no teacher, no scaling), two contrasting levers: (M2, NEGATIVE) a neurosymbolic multi-turn REPL loop (draft -> execute -> real feedback -> refine) does NOT beat matched-compute independent sampling -- repl_real 0.287 @ ~3.9 gens sits on/below the sample_more curve which reaches 0.338 @ 5; and the execution-feedback CONTENT adds only +0.024 over a PAIRED no-feedback control (within noise). Where the model cannot sample a solution (depth >=3, all arms 0.0) feedback adds nothing. So test-time self-correction does not push past the frozen model's sampling distribution. (M3, POSITIVE) QLoRA-SFT on the 4B's OWN 189 execution-verified (prompt->code) solutions (no teacher) banks capability into deployable single-shot: held-out fresh think-greedy@1 0.224 -> 0.319 (+0.095, ~2.2 SE over N=210, +42% relative), pass@5 rises 0.310 -> 0.371 (NO diversity collapse), confirmed on two fresh seeds and broad across depths 1-3. Notably this self-training WORKS here but REGRESSED on contaminated MBPP (qwen35_4b_verifier_guided_self_improvement), implicating substrate/contamination -- not the method -- in that earlier failure. REPLICATED: a second, independently-trained adapter (fresh training data, seed 505) reproduced the held-out gain (+0.103, matching the original +0.111), so the banking effect is robust to the training data, not a single-adapter artifact. EXPERT ITERATION (M4): scaled into a 3-round flywheel (solve pool with current model -> accumulate verified pairs -> retrain from base -> eval), the banking gain COMPOUNDS monotonically 0.267 -> 0.356 -> 0.385 -> 0.393 (+0.126, +47%) with pass@5 rising throughout (no collapse) and each round harvesting more verified data (107->144->162 of 360 solved; 147->287 pairs). But it shows clear DIMINISHING RETURNS (+.089,+.029,+.008, plateauing) and is COVERAGE-BOUNDED: it lifts depths 1-2 but never cracks the depth-3 frontier the model can't sample. Self-training widens the deployable footprint of the model's own distribution; it does not extend the distribution's frontier.","For small-model capability: don't try to read the frozen weights more cleverly at test time (execution-feedback self-correction doesn't beat sampling) -- BANK sampling-accessible capability into the weights by self-training on what the model can already verify. And evaluate self-training on CONTAMINATION-CONTROLLED substrates: MBPP-based self-improvement results are confounded, and a clean structured substrate is what lets honest self-improvement show up. On-mission: no teacher, no scaling."
C12,The fixed 4B's compositional frontier extends without a teacher via tool-augmented search + banking,Promising,structured_execution_and_compilers;posttraining_and_adaptation,qwen35_4b_decompose_compose_frontier,"On the contamination-free depth-graded program-synthesis substrate, C11/M4 left the depth-3 frontier uncrackable by self-training (coverage-bounded). A decompose-and-compose search (the 4B ranks the next primitive via a letter-logit read of current-state->target; the interpreter executes it to materialize the intermediate state; recurse/backtrack over 23 primitives) CRACKS it: hidden-generalizing depth-3 solve rate monolithic 0.125 -> decompose 0.40-0.43 (3.4x). BUT against the brute-force bar (23 primitives -> blind enumeration already solves depth-3), the model's GUIDANCE buys EFFICIENCY not COVERAGE: guided solves with ~2.5x fewer interpreter calls and wins the low-budget regime, but PLATEAUS (planner-wall -- where its ranking misses it never recovers) while brute-force enumeration matches/beats it at high budget (d2 guided 0.575 vs brute 0.875; d3 converge ~0.40). So the frontier crack is the composition-structure + interpreter, not the model's planning -- the wall RELOCATES to the planner. Crucially, BANKING the search-found solutions (QLoRA-SFT on 327 (prompt->code) traces, no teacher) EXTENDS the frontier into the weights: monolithic held-out pass@5 0.125->0.237 (+0.112, ~2.6 SE), depth-3 pass@5 0.025->0.100 (4x), greedy@1 0.075->0.125 (+0.05, ~1.5 SE), no-think one-shot 0->0.062. This is the exact bound M4 (confined to the sampling distribution) could not break: search+interpreter harvested solutions OUTSIDE the sampling support and banking pulled them INTO it. REPLICATED: a second harvest seed reproduces banking (greedy 0.125 identical; pass@5 0.263; d3 pass@5 0.175). RETRO-AUDIT CORRECTION (behavioral min-depth): the generator did not exclude shallower-equivalent compositions -- 40% of nominal depth-3 tasks are behaviorally depth<=2. Re-sliced, decompose solved 16/16 collapsed but only 4/24 (17%) TRUE depth-3 (monolithic true-d3 = 0/24, and 0 corpus-wide); the banking eval is ~30% collapsed at d3 (mixed-population caveat). The frontier extension is real (17% > 0) but far more modest than nominal numbers; every prior 'depth-3' figure in the arc was inflated by this artifact. Verified-depth follow-up: depth-wall anatomy experiment.","To extend a fixed small model's frontier without a teacher: use tool-augmented search (composition + an interpreter, both allowed calculators/algorithms) to harvest execution-verified solutions OUTSIDE its sampling support, then self-train on them. The model's own planning helps search EFFICIENCY but not COVERAGE -- the search structure + interpreter carry the crack, so don't credit the model with out-searching brute force."
C13,The fixed 4B's compositional wall is broken multi-step mental simulation; transcription is intact,Promising,structured_execution_and_compilers;interpretability_and_diagnostics,qwen35_4b_depth_wall_anatomy,"Pre-registered anatomy of the compositional 'depth wall' (experiment qwen35_4b_depth_wall_anatomy). (1) MEASUREMENT: a behavioral min-depth audit found 40% of nominal depth-3 substrate tasks are shallower-equivalent; true monolithic depth-3 solves were 0 corpus-wide (C12 retro-corrected). (2) LAW: on a verified factorial grid (17 cells, depth 1-5 x destructive-ops 0-3, n=25/cell, 425 tasks), the pre-registered information-destruction hypothesis DIED (k=0 deep compositions unsolvable; op type irrelevant: logistic coefs -3.24 vs -3.87) and a uniform law replaced it: solve odds fall ~30x per composed op (~-3.5 logits/op) -- against the 63-op space, identification beyond the first primitive is only ~2x better than chance, walling at depth TWO. (3) MECHANISM (three-condition discriminator, same verified tasks): plan-given execution is 0.90-1.00 through depth 4 at every destruction level -- ZERO execution deficit -- while bare identification is 0.00-0.10 and even intermediates-shown only reaches 0.00-0.30 (the model cannot SEGMENT observed state-chains into the depth-1 identifications it performs at 0.88). Convergent constant: the ~2x-over-chance/op law independently equals C12's ~2x guided-vs-brute search efficiency. One mechanism -- a reliable compiler starved of hypothesis search -- quantitatively retro-explains C10 (verify>>generate: verification is execution-shaped), C11 (banking is coverage-bounded because SFT teaches production, not identification), C12 (decompose+interpreter works because it externalizes segmentation+search; its modest guidance edge IS the 2x constant), and M2 (execution feedback fails because identification, not correction, binds). PHASE-3 REFINEMENT (pre-registered P10/P11): pre-segmenting the chain into isolated per-step blocks only partially rescues (0.50/0.25 at d2/d3, 0.00 at d4 -- per-step identification DEGRADES in composite context, an interference effect beyond search), and no-think 2AFC discrimination of the true pipeline vs a one-op decoy is weak (~0.73, chance at d4k2) despite ~1.0 plan-execution. COMPLETED LADDER (same tasks): execution 1.00 > discrimination ~0.73 > segmented identification 0.50->0.00 > bare identification ~0.0. Refined mechanism: only the FORWARD direction (program->behavior) is intact; every INVERSE task (behavior->program) is weak and decays with composition length, even with search and segmentation externalized. P12 (pre-registered, predicted >=0.9): thinking-mode 2AFC scored 0.50 -- CHANCE, and WORSE than the no-think logit read (0.73, ~3.6 SE, same items): deliberate simulate-and-compare fails because the model's mental execution of composed pipelines is systematically wrong, destroying the surface signal. REFRAME: plan-given 1.00 is TRANSCRIPTION (the interpreter executes; the model writes code). Intact: single-step recognition (0.88) + program->code transcription (~1.0). Broken: MULTI-STEP MENTAL SIMULATION -- the single deficit underlying identification, segmentation, discrimination, and M2's feedback-use failure. Also refines C9: thinking helps when its content is coherent reasoning; when the required content is simulation, the model generates it wrongly and thinking HURTS.","For fixed small models: plan-conditioned execution is nearly free capability -- give the model the plan and it compiles reliably; the scarce resource is hypothesis identification/search, which cheap external tools (enumeration + interpreter) supply. Build systems where tools identify and the model compiles. Do not spend training on execution (already ~1.0); target identification/segmentation if training at all. And never trust nominal composition depth without a behavioral min-depth check."
C14,Repairing a broken primitive does not propagate: capability is format-local in the fixed 4B,Promising,structured_execution_and_compilers;posttraining_and_adaptation,qwen35_4b_simulation_keystone_repair,"Pre-registered intervention test of C13's causal claim (experiment qwen35_4b_simulation_keystone_repair). QLoRA-SFT on interpreter-generated state-chain traces FULLY REPAIRED the broken simulator (output exact-match 0.80-0.84 through depth 5 vs base 0.30-0.36; +54pp LENGTH-GENERALIZATION beyond trained depths; held-out-primitive transfer 0.42->0.85 -- a genuine skill, not memorization). Yet the inverse-capability ladder DID NOT MOVE: bare identification 0.08->0.09, segmented 0.14->0.17. The matched-token control (PROD: direct I/O->code SFT) moved segmented identification 3x (0.14->0.41) -- transfer follows FORMAT ADJACENCY, not primitive dependency -- while degrading plan-given transcription (0.93->0.72), and both adapters crashed thinking-2AFC to ~0.10 via verified FORMAT CAPTURE (answering the A/B question in their trained output format). Phase-0 bonus (P-K0b refuted): thinking HELPS single-pipeline simulation (0.58 vs 0.46 at d3) -- deliberate simulation is length-fragile, not globally wrong; C13/P12's chance-level 2AFC was the double-simulation+comparison load. VERDICT (locked decision rules): KEYSTONE REFUTED, separable-representation branch. Capability in the fixed 4B is organized by input->output FORMAT MAPPINGS, not shared internal primitives: repairing the underlying skill does not propagate, cross-task transfer is format-adjacent, and narrow-format SFT taxes unrelated instruction-following.","Mechanistic diagnoses do not license training-transfer predictions: SFT buys the trained mapping plus its format neighborhood, nothing more. This bounds the banking program (C11/C12 teach mappings, not components -- explaining why banking never moved the planner or verification) and reinforces C13's deployment rule: externalize missing primitives with tools rather than installing them and hoping they propagate. When SFT-ing small models, expect format capture: narrow-format training damages unrelated instruction-following (mix formats or isolate adapters per task)."
